{
  "profile_id": "dp-pdac-stromal-barrier",
  "disease_id": "pdac",
  "disease_label": "Pancreatic ductal adenocarcinoma",
  "created_at": "2026-09-20T00:00:00Z",
  "schema_version": "1.0.0",
  "asker_role": "researcher",
  "answers": {
    "role": {
      "question": "Who is asking?",
      "choice_id": "researcher",
      "choice_label": "Researcher"
    },
    "cancer": {
      "question": "Which disease \u2014 not cancer?",
      "choice_id": "pdac",
      "choice_label": "Pancreatic ductal adenocarcinoma"
    },
    "setting": {
      "question": "What is the current regime?",
      "choice_id": "metastatic",
      "choice_label": "Metastatic / relapsed"
    },
    "stuck": {
      "question": "Where is the system stuck?",
      "choice_id": "late",
      "choice_label": "Found too late"
    }
  },
  "observables": [
    {
      "statement": "NCI pancreatic cancer pages describe a disease often found late, with dense stroma as a clinical and biological challenge. That is setting context, not an identified S_fib value.",
      "citation_ids": [
        "3"
      ]
    },
    {
      "statement": "Research framing: desmoplasia as a delivery and detection barrier. A better ODE will not move median diagnosis earlier.",
      "citation_ids": [
        "5"
      ]
    }
  ],
  "candidate_mechanisms": [
    {
      "statement": "Desmoplastic stroma may act as a drug-delivery and detection barrier in PDAC; lumped handles such as S_fib remain assumed annotations unless independently identified.",
      "evidence_class": "review_level",
      "citation_ids": [
        "3",
        "5"
      ],
      "falsifier": "If a named stromal-disruption experiment does not change delivery or burden signatures in the stated model context, retire the barrier-as-load-bearing-loop claim. Do not write \u0398 from an OnCo page."
    },
    {
      "statement": "OnCo LDHA knowledge and confidence.probability can be entered as the confluence_v2_15d parameter p_lactate (or legacy pyruvate_to_lactate).",
      "evidence_class": "knowledge",
      "citation_ids": [
        "4"
      ],
      "falsifier": "Rejected a priori: Knowledge is not a parameter."
    }
  ],
  "non_parameters": [
    "OnCo knowledge records (pages, targets, ideas)",
    "OnCo confidence.probability",
    "OnCo Idea maturity",
    "Legacy validation/gene_to_parameter_map.json values (including LDHA \u2192 pyruvate_to_lactate)",
    "CONFLUENCE v2 symbols such as p_lactate unless independently identified",
    "Auditor classification scores",
    "Grok evidence-audit output",
    "Thinking-lab role, setting, or stuck labels",
    "Clinical intent, cure language, or dosing",
    "Stage-at-diagnosis ideas from OnCo",
    "Adding OnCo targets to CancerODE RHS"
  ],
  "admitted_hypotheses": [
    {
      "statement": "Desmoplastic stroma may act as a drug-delivery and detection barrier in PDAC; lumped handles such as S_fib remain assumed annotations unless independently identified.",
      "layer": "hypothesis",
      "evidence_class": "review_level",
      "citation_ids": [
        "3",
        "5"
      ],
      "falsifier": "If a named stromal-disruption experiment does not change delivery or burden signatures in the stated model context, retire the barrier-as-load-bearing-loop claim. Do not write \u0398 from an OnCo page.",
      "gates_passed": [
        "Knowledge\u2260Evidence",
        "Evidence\u2260Mechanism",
        "Mechanism\u2260Parameter",
        "Parameter\u2260Prediction",
        "not_clinical_outcome"
      ],
      "parameter_status": "forbidden_to_enter_theta"
    }
  ],
  "citations": [
    {
      "id": "1",
      "text": "Sung H, Filho AM, Laversanne M, et al. Global cancer statistics 2024. CA Cancer J Clin. 2026.",
      "url": "https://doi.org/10.3322/caac.70090",
      "doi": "10.3322/caac.70090"
    },
    {
      "id": "2",
      "text": "World Health Organization. Cancer fact sheet. 2026.",
      "url": "https://www.who.int/news-room/fact-sheets/detail/cancer",
      "doi": null
    },
    {
      "id": "3",
      "text": "National Cancer Institute. Pancreatic cancer treatment (PDQ).",
      "url": "https://www.cancer.gov/types/pancreatic/hp/pancreatic-treatment-pdq",
      "doi": null
    },
    {
      "id": "4",
      "text": "Gomila J, OnCo contributors. OnCo. 2026. Data CC BY-NC 4.0.",
      "url": "https://onco.cc",
      "doi": null
    },
    {
      "id": "5",
      "text": "Altrock PM, Liu LL, Michor F. The mathematics of cancer: integrating quantitative models. Nat Rev Cancer. 2015.",
      "url": "https://www.ncbi.nlm.nih.gov/pmc/articles/PMC5663316/",
      "doi": "10.1038/nrc4029"
    },
    {
      "id": "6",
      "text": "Project Confluence. DISCLAIMER.md. Medical non-claims.",
      "url": "https://github.com/cloudynirvana/project-confluence/blob/main/DISCLAIMER.md",
      "doi": null
    }
  ],
  "disclaimer": "Project Confluence disease profiles are computational research artefacts. They are not a medical device, not clinical decision support, not personalized medicine as clinical CDS, and not a claim of cure, diagnosis, or dosing. In-silico / research only. See DISCLAIMER.md."
}
