{
  "profile_id": "dp-gbm-invasive-niche",
  "disease_id": "gbm",
  "disease_label": "Glioblastoma",
  "created_at": "2026-09-20T00:00:00Z",
  "schema_version": "1.0.0",
  "asker_role": "researcher",
  "answers": {
    "role": {
      "question": "Who is asking?",
      "choice_id": "researcher",
      "choice_label": "Researcher"
    },
    "cancer": {
      "question": "Which disease \u2014 not cancer?",
      "choice_id": "gbm",
      "choice_label": "Glioblastoma"
    },
    "setting": {
      "question": "What is the current regime?",
      "choice_id": "local",
      "choice_label": "Localised / early"
    },
    "stuck": {
      "question": "Where is the system stuck?",
      "choice_id": "undruggable",
      "choice_label": "Target known, not reachable"
    }
  },
  "observables": [
    {
      "statement": "NCI describes glioblastoma as an aggressive malignant brain tumour. That descriptor is setting context, not a CONFLUENCE parameter or a clinical stage claim from this repository.",
      "citation_ids": [
        "3"
      ]
    },
    {
      "statement": "Research framing: spatial invasion, hypoxia, and immune privilege inside an organ that cannot be widely resected. Framing is a systems board, not a measured 15-D coupling.",
      "citation_ids": [
        "5"
      ]
    }
  ],
  "candidate_mechanisms": [
    {
      "statement": "Invasive niche, hypoxia, and immune privilege may jointly limit clearance as a spatial evolutionary process in GBM and can be posed as an in-silico hypothesis with a named falsifier.",
      "evidence_class": "review_level",
      "citation_ids": [
        "3",
        "5"
      ],
      "falsifier": "If a named imaging or tissue assay in a stated cohort shows invasion without the putative hypoxia\u2013privilege coupling, drop the joint claim. Do not import ROS from tnbc_mod_3s or write \u0398."
    },
    {
      "statement": "OnCo LDHA knowledge and confidence.probability can be entered as the confluence_v2_15d parameter p_lactate (or legacy pyruvate_to_lactate).",
      "evidence_class": "knowledge",
      "citation_ids": [
        "4"
      ],
      "falsifier": "Rejected a priori: Knowledge is not a parameter."
    }
  ],
  "non_parameters": [
    "OnCo knowledge records (pages, targets, ideas)",
    "OnCo confidence.probability",
    "OnCo Idea maturity",
    "Legacy validation/gene_to_parameter_map.json values (including LDHA \u2192 pyruvate_to_lactate)",
    "CONFLUENCE v2 symbols such as p_lactate unless independently identified",
    "Auditor classification scores",
    "Grok evidence-audit output",
    "Thinking-lab role, setting, or stuck labels",
    "Clinical intent, cure language, or dosing",
    "Fly connectome stubs (not a brain-tumour controller)",
    "Hypoxia or invasion labels as ODE \u0398"
  ],
  "admitted_hypotheses": [
    {
      "statement": "Invasive niche, hypoxia, and immune privilege may jointly limit clearance as a spatial evolutionary process in GBM and can be posed as an in-silico hypothesis with a named falsifier.",
      "layer": "hypothesis",
      "evidence_class": "review_level",
      "citation_ids": [
        "3",
        "5"
      ],
      "falsifier": "If a named imaging or tissue assay in a stated cohort shows invasion without the putative hypoxia\u2013privilege coupling, drop the joint claim. Do not import ROS from tnbc_mod_3s or write \u0398.",
      "gates_passed": [
        "Knowledge\u2260Evidence",
        "Evidence\u2260Mechanism",
        "Mechanism\u2260Parameter",
        "Parameter\u2260Prediction",
        "not_clinical_outcome"
      ],
      "parameter_status": "forbidden_to_enter_theta"
    }
  ],
  "citations": [
    {
      "id": "1",
      "text": "Sung H, Filho AM, Laversanne M, et al. Global cancer statistics 2024. CA Cancer J Clin. 2026.",
      "url": "https://doi.org/10.3322/caac.70090",
      "doi": "10.3322/caac.70090"
    },
    {
      "id": "2",
      "text": "World Health Organization. Cancer fact sheet. 2026.",
      "url": "https://www.who.int/news-room/fact-sheets/detail/cancer",
      "doi": null
    },
    {
      "id": "3",
      "text": "National Cancer Institute. Adult central nervous system tumors treatment (PDQ) \u2014 glioblastoma context.",
      "url": "https://www.cancer.gov/types/brain/hp/adult-brain-treatment-pdq",
      "doi": null
    },
    {
      "id": "4",
      "text": "Gomila J, OnCo contributors. OnCo. 2026. Data CC BY-NC 4.0.",
      "url": "https://onco.cc",
      "doi": null
    },
    {
      "id": "5",
      "text": "Altrock PM, Liu LL, Michor F. The mathematics of cancer: integrating quantitative models. Nat Rev Cancer. 2015.",
      "url": "https://www.ncbi.nlm.nih.gov/pmc/articles/PMC5663316/",
      "doi": "10.1038/nrc4029"
    },
    {
      "id": "6",
      "text": "Project Confluence. DISCLAIMER.md. Medical non-claims.",
      "url": "https://github.com/cloudynirvana/project-confluence/blob/main/DISCLAIMER.md",
      "doi": null
    }
  ],
  "disclaimer": "Project Confluence disease profiles are computational research artefacts. They are not a medical device, not clinical decision support, not personalized medicine as clinical CDS, and not a claim of cure, diagnosis, or dosing. In-silico / research only. See DISCLAIMER.md."
}
